{
  "schemaVersion": "jobservatory.hierarchical-classifier-eval.v1",
  "task": "hierarchical multi-label listing classification",
  "data": {
    "corpusGeneratedAt": "2026-08-17T10:27:40+00:00",
    "observations": 1709,
    "corpusSnapshot": "ml/eval/snapshots/classifier-corpus-a20808a4486e8008.json.gz",
    "corpusCanonicalSha256": "a20808a4486e80087a595889d1726a29f89c07cf7829ca32721e2fce24bf8351",
    "splitMethod": "duplicate-grouped chronological order using source update, source publication, then retrieval time",
    "splitSemantics": "development source-time split; not a longitudinal observation holdout",
    "splits": {
      "train": 1197,
      "calibration": 256,
      "evaluation": 256
    },
    "targetProvenance": "versioned rule-generated weak labels",
    "features": "title and location TF-IDF only; employer and rule-selected evidence excluded"
  },
  "hierarchy": {
    "parents": [
      "domain",
      "layer",
      "relationship",
      "seniority",
      "skill"
    ],
    "leafLabels": 42,
    "parentConsistency": 1.0
  },
  "model": {
    "type": "per-label class-weighted logistic regression plus held-split Platt calibration",
    "features": 1557,
    "randomSeed": 42
  },
  "abstention": {
    "policy": "per-label calibrated threshold plus/minus margin",
    "margin": 0.05,
    "microDecisionCoverage": 0.9536
  },
  "aggregate": {
    "microPrecision": 0.6913,
    "microRecall": 0.6462,
    "microF1": 0.668,
    "macroF1": 0.3705,
    "tailLabelMacroF1": 0.1833,
    "brierScore": 0.0637,
    "expectedCalibrationError": 0.0111
  },
  "perLabel": {
    "domain/AI-adjacent operations": {
      "trainSupport": 228,
      "evaluationSupport": 56,
      "threshold": 0.45,
      "abstentionMargin": 0.05,
      "coverage": 0.9414,
      "precision": 0.6071,
      "recall": 0.9623,
      "f1": 0.7445
    },
    "domain/Education & training": {
      "trainSupport": 65,
      "evaluationSupport": 11,
      "threshold": 0.25,
      "abstentionMargin": 0.05,
      "coverage": 1.0,
      "precision": 0.6471,
      "recall": 1.0,
      "f1": 0.7857
    },
    "domain/ML engineering": {
      "trainSupport": 209,
      "evaluationSupport": 36,
      "threshold": 0.39,
      "abstentionMargin": 0.05,
      "coverage": 0.9883,
      "precision": 0.9167,
      "recall": 0.3235,
      "f1": 0.4783
    },
    "domain/Product & leadership": {
      "trainSupport": 262,
      "evaluationSupport": 43,
      "threshold": 0.29,
      "abstentionMargin": 0.05,
      "coverage": 0.9805,
      "precision": 0.8056,
      "recall": 0.7632,
      "f1": 0.7838
    },
    "domain/Robotics & embedded": {
      "trainSupport": 245,
      "evaluationSupport": 78,
      "threshold": 0.28,
      "abstentionMargin": 0.05,
      "coverage": 0.9453,
      "precision": 0.6129,
      "recall": 0.7808,
      "f1": 0.6867
    },
    "domain/Safety & governance": {
      "trainSupport": 37,
      "evaluationSupport": 8,
      "threshold": 0.24,
      "abstentionMargin": 0.05,
      "coverage": 0.9961,
      "precision": 1.0,
      "recall": 0.4286,
      "f1": 0.6
    },
    "domain/Scientific AI": {
      "trainSupport": 151,
      "evaluationSupport": 24,
      "threshold": 0.1,
      "abstentionMargin": 0.05,
      "coverage": 0.9883,
      "precision": 0.9583,
      "recall": 1.0,
      "f1": 0.9787
    },
    "layer/data": {
      "trainSupport": 232,
      "evaluationSupport": 31,
      "threshold": 0.23,
      "abstentionMargin": 0.05,
      "coverage": 0.3477,
      "precision": 0.2973,
      "recall": 1.0,
      "f1": 0.4583
    },
    "layer/evaluation": {
      "trainSupport": 313,
      "evaluationSupport": 66,
      "threshold": 0.49,
      "abstentionMargin": 0.05,
      "coverage": 0.9805,
      "precision": 0.5556,
      "recall": 0.0794,
      "f1": 0.1389
    },
    "layer/infrastructure": {
      "trainSupport": 409,
      "evaluationSupport": 87,
      "threshold": 0.45,
      "abstentionMargin": 0.05,
      "coverage": 0.8281,
      "precision": 0.5882,
      "recall": 0.1429,
      "f1": 0.2299
    },
    "layer/product": {
      "trainSupport": 107,
      "evaluationSupport": 29,
      "threshold": 0.2,
      "abstentionMargin": 0.05,
      "coverage": 0.9727,
      "precision": 0.5,
      "recall": 0.1538,
      "f1": 0.2353
    },
    "layer/safety": {
      "trainSupport": 130,
      "evaluationSupport": 28,
      "threshold": 0.26,
      "abstentionMargin": 0.05,
      "coverage": 0.9688,
      "precision": 0.875,
      "recall": 0.2593,
      "f1": 0.4
    },
    "layer/serving": {
      "trainSupport": 496,
      "evaluationSupport": 128,
      "threshold": 0.38,
      "abstentionMargin": 0.05,
      "coverage": 0.8047,
      "precision": 0.637,
      "recall": 0.819,
      "f1": 0.7167
    },
    "layer/training": {
      "trainSupport": 174,
      "evaluationSupport": 14,
      "threshold": 0.32,
      "abstentionMargin": 0.05,
      "coverage": 0.9727,
      "precision": 0.4545,
      "recall": 0.3846,
      "f1": 0.4167
    },
    "relationship/builds": {
      "trainSupport": 39,
      "evaluationSupport": 5,
      "threshold": 0.5,
      "abstentionMargin": 0.05,
      "coverage": 1.0,
      "precision": 0.0,
      "recall": 0.0,
      "f1": 0.0
    },
    "relationship/deploys": {
      "trainSupport": 37,
      "evaluationSupport": 4,
      "threshold": 0.5,
      "abstentionMargin": 0.05,
      "coverage": 1.0,
      "precision": 0.0,
      "recall": 0.0,
      "f1": 0.0
    },
    "relationship/evaluates": {
      "trainSupport": 66,
      "evaluationSupport": 10,
      "threshold": 0.1,
      "abstentionMargin": 0.05,
      "coverage": 0.9688,
      "precision": 0.0,
      "recall": 0.0,
      "f1": 0.0
    },
    "relationship/governs": {
      "trainSupport": 30,
      "evaluationSupport": 0,
      "threshold": 0.5,
      "abstentionMargin": 0.05,
      "coverage": 1.0,
      "precision": 0.0,
      "recall": 0.0,
      "f1": 0.0
    },
    "relationship/uses": {
      "trainSupport": 73,
      "evaluationSupport": 4,
      "threshold": 0.45,
      "abstentionMargin": 0.05,
      "coverage": 1.0,
      "precision": 0.0,
      "recall": 0.0,
      "f1": 0.0
    },
    "seniority/Early career": {
      "trainSupport": 25,
      "evaluationSupport": 1,
      "threshold": 0.5,
      "abstentionMargin": 0.05,
      "coverage": 1.0,
      "precision": 0.0,
      "recall": 0.0,
      "f1": 0.0
    },
    "seniority/Leadership": {
      "trainSupport": 31,
      "evaluationSupport": 11,
      "threshold": 0.1,
      "abstentionMargin": 0.05,
      "coverage": 0.9844,
      "precision": 1.0,
      "recall": 1.0,
      "f1": 1.0
    },
    "seniority/Mid-level / unspecified": {
      "trainSupport": 520,
      "evaluationSupport": 100,
      "threshold": 0.47,
      "abstentionMargin": 0.05,
      "coverage": 0.9844,
      "precision": 0.94,
      "recall": 0.9691,
      "f1": 0.9543
    },
    "seniority/Senior": {
      "trainSupport": 330,
      "evaluationSupport": 104,
      "threshold": 0.29,
      "abstentionMargin": 0.05,
      "coverage": 0.9648,
      "precision": 0.8644,
      "recall": 0.9808,
      "f1": 0.9189
    },
    "seniority/Staff+": {
      "trainSupport": 291,
      "evaluationSupport": 40,
      "threshold": 0.22,
      "abstentionMargin": 0.05,
      "coverage": 0.9961,
      "precision": 1.0,
      "recall": 1.0,
      "f1": 1.0
    },
    "skill/AWS": {
      "trainSupport": 166,
      "evaluationSupport": 20,
      "threshold": 0.28,
      "abstentionMargin": 0.05,
      "coverage": 0.9688,
      "precision": 0.7,
      "recall": 0.4375,
      "f1": 0.5385
    },
    "skill/Agents": {
      "trainSupport": 145,
      "evaluationSupport": 15,
      "threshold": 0.44,
      "abstentionMargin": 0.05,
      "coverage": 1.0,
      "precision": 0.0,
      "recall": 0.0,
      "f1": 0.0
    },
    "skill/C++": {
      "trainSupport": 283,
      "evaluationSupport": 71,
      "threshold": 0.19,
      "abstentionMargin": 0.05,
      "coverage": 0.875,
      "precision": 0.4435,
      "recall": 0.7969,
      "f1": 0.5698
    },
    "skill/Evaluation": {
      "trainSupport": 70,
      "evaluationSupport": 10,
      "threshold": 0.11,
      "abstentionMargin": 0.05,
      "coverage": 0.9766,
      "precision": 0.5,
      "recall": 0.1,
      "f1": 0.1667
    },
    "skill/Go": {
      "trainSupport": 26,
      "evaluationSupport": 6,
      "threshold": 0.5,
      "abstentionMargin": 0.05,
      "coverage": 1.0,
      "precision": 0.0,
      "recall": 0.0,
      "f1": 0.0
    },
    "skill/Governance": {
      "trainSupport": 24,
      "evaluationSupport": 0,
      "threshold": 0.5,
      "abstentionMargin": 0.05,
      "coverage": 1.0,
      "precision": 0.0,
      "recall": 0.0,
      "f1": 0.0
    },
    "skill/Kubernetes": {
      "trainSupport": 102,
      "evaluationSupport": 15,
      "threshold": 0.28,
      "abstentionMargin": 0.05,
      "coverage": 0.9609,
      "precision": 0.0,
      "recall": 0.0,
      "f1": 0.0
    },
    "skill/LLMs": {
      "trainSupport": 340,
      "evaluationSupport": 36,
      "threshold": 0.37,
      "abstentionMargin": 0.05,
      "coverage": 0.9805,
      "precision": 0.3636,
      "recall": 0.1143,
      "f1": 0.1739
    },
    "skill/PyTorch": {
      "trainSupport": 114,
      "evaluationSupport": 4,
      "threshold": 0.42,
      "abstentionMargin": 0.05,
      "coverage": 0.9883,
      "precision": 0.0,
      "recall": 0.0,
      "f1": 0.0
    },
    "skill/Python": {
      "trainSupport": 557,
      "evaluationSupport": 106,
      "threshold": 0.46,
      "abstentionMargin": 0.05,
      "coverage": 0.9414,
      "precision": 0.5391,
      "recall": 0.6263,
      "f1": 0.5794
    },
    "skill/RAG": {
      "trainSupport": 86,
      "evaluationSupport": 8,
      "threshold": 0.15,
      "abstentionMargin": 0.05,
      "coverage": 0.9883,
      "precision": 0.0,
      "recall": 0.0,
      "f1": 0.0
    },
    "skill/Robotics": {